{
  "$schema": "./schemas/image-size-budgets.schema.json",
  "unit": "MiB",
  "max_growth_percent": 10,
  "baseline_date": "2026-05-23",
  "update_process": "docs/size-budgets.md",
  "images": {
    "node:20": {
      "max_mib": 650,
      "baseline_mib": 558.1,
      "baseline_ci_mib": 605.5
    },
    "node:22": {
      "max_mib": 650,
      "baseline_mib": 570.2,
      "baseline_ci_mib": 613.4
    },
    "bun:1": {
      "max_mib": 700,
      "baseline_mib": 640.8,
      "baseline_ci_mib": 651.5
    },
    "hugo:latest": {
      "max_mib": 275,
      "baseline_mib": 215.6,
      "baseline_ci_mib": 246.7
    },
    "zola:latest": {
      "max_mib": 250,
      "baseline_mib": 208.4,
      "baseline_ci_mib": 208.4
    }
  }
}
